title,url_slug,description,image,category_name,secondary_category_names,skill_level,lesson_link,published_date,published_time,status,moderation_status,visibility,is_featured,allow_comments,tags
"Introduction to Machine Learning Fundamentals","intro-machine-learning-fundamentals","Learn the core concepts of machine learning including supervised learning, unsupervised learning, and neural networks. This comprehensive course covers algorithms, data preprocessing, model evaluation, and practical implementation using Python and popular ML libraries.","https://example.com/images/ml-fundamentals.jpg","Data Science","AI;Technology","Beginner","https://example.com/courses/ml-fundamentals","2024-01-15","10:00","Published","Approved","Public",true,true,"machine learning;python;data science;algorithms;neural networks"
"Advanced Deep Learning with TensorFlow","advanced-deep-learning-tensorflow","Master advanced deep learning techniques using TensorFlow and Keras. Explore convolutional neural networks, recurrent neural networks, GANs, and transformer architectures. Build complex AI models for computer vision, natural language processing, and more.","https://example.com/images/tensorflow-course.jpg","Programming","AI;Data Science","Advanced","https://example.com/courses/tensorflow-advanced","2024-01-14","14:30","Published","Approved","Public",false,true,"tensorflow;deep learning;CNN;RNN;transformers;computer vision"
"React.js Complete Developer Bootcamp","reactjs-complete-bootcamp","Comprehensive React.js course covering hooks, context API, state management with Redux, testing, and deployment. Build real-world applications including e-commerce sites, social media platforms, and dashboard applications using modern React patterns.","https://example.com/images/react-bootcamp.jpg","Web Development","JavaScript;Frontend","Intermediate","https://example.com/courses/react-bootcamp","2024-01-13","09:15","Published","Approved","Public",true,false,"react;javascript;frontend;hooks;redux;web development"
"Blockchain Development with Solidity","blockchain-development-solidity","Learn blockchain development from scratch using Solidity and Ethereum. Understand smart contracts, DeFi protocols, NFTs, and Web3 integration. Build decentralized applications (dApps) and deploy them to various blockchain networks.","https://example.com/images/blockchain-solidity.jpg","Blockchain","Cryptocurrency;Programming","Intermediate","https://example.com/courses/blockchain-solidity","2024-01-12","16:45","Published","Approved","Public",false,true,"blockchain;solidity;ethereum;smart contracts;defi;web3"
"Data Visualization with Python and D3.js","data-visualization-python-d3","Master data visualization techniques using Python libraries (Matplotlib, Seaborn, Plotly) and D3.js for interactive web visualizations. Learn to create compelling charts, dashboards, and interactive data stories that communicate insights effectively.","https://example.com/images/data-viz.jpg","Data Science","Web Development;Design","Beginner","https://example.com/courses/data-visualization","2024-01-11","12:20","Published","Approved","Public",true,true,"data visualization;python;d3js;matplotlib;plotly;dashboards"
"Cloud Architecture on AWS","cloud-architecture-aws","Comprehensive AWS cloud architecture course covering EC2, S3, RDS, Lambda, and other core services. Learn to design scalable, secure, and cost-effective cloud solutions. Prepare for AWS Solutions Architect certification with hands-on projects.","https://example.com/images/aws-architecture.jpg","Cloud Computing","DevOps;Infrastructure","Intermediate","https://example.com/courses/aws-architecture","2024-01-10","08:00","Published","Approved","Public",false,true,"aws;cloud computing;architecture;ec2;lambda;devops"
