headline,seo_title,url_slug,content,category_name,secondary_category_names,image,published_date,published_time,status,moderation_status,visibility,is_featured,allow_comments,tags
"OpenAI Releases GPT-5 with Revolutionary Multimodal Capabilities","GPT-5: OpenAI's Game-Changing AI Model","openai-gpt5-multimodal-release","OpenAI has announced the release of GPT-5, marking a significant leap forward in artificial intelligence capabilities. The new model features enhanced multimodal processing, allowing it to understand and generate content across text, images, audio, and video with unprecedented accuracy. GPT-5 demonstrates improved reasoning capabilities, reduced hallucinations, and better understanding of context across longer conversations. Early testing shows remarkable performance in scientific research, creative tasks, and complex problem-solving scenarios.","Technology","AI;Machine Learning","https://example.com/images/gpt5-release.jpg","2024-01-20","09:30","Published","Approved","FeaturedOnHomepage",true,true,"openai;gpt5;artificial intelligence;multimodal;AI breakthrough"
"Google DeepMind Achieves Breakthrough in Protein Folding","DeepMind Protein Folding Breakthrough","google-deepmind-protein-folding","Google DeepMind has announced a major breakthrough in protein folding prediction, with their latest AlphaFold model achieving 99% accuracy in predicting protein structures. This advancement could revolutionize drug discovery, disease treatment, and biological research. The new model can predict complex protein interactions and design novel proteins for specific functions. Researchers worldwide are already using this technology to accelerate pharmaceutical development and understand genetic diseases better.","Science","Healthcare;Research","https://example.com/images/protein-folding.jpg","2024-01-19","14:15","Published","Approved","Public",false,true,"google;deepmind;protein folding;alphafold;biotechnology;drug discovery"
"Microsoft Copilot Integration Transforms Enterprise Productivity","Microsoft Copilot Enterprise Integration","microsoft-copilot-enterprise-productivity","Microsoft has rolled out comprehensive Copilot integration across its enterprise suite, fundamentally changing how businesses operate. The AI assistant now seamlessly works within Office 365, Teams, SharePoint, and other Microsoft services, providing intelligent automation and assistance. Early adopters report 40% improvements in productivity, with employees spending less time on routine tasks and more time on strategic work. The integration includes advanced security features and compliance tools for enterprise requirements.","Business","Technology;Productivity","https://example.com/images/microsoft-copilot.jpg","2024-01-18","11:45","Published","Approved","Public",true,false,"microsoft;copilot;enterprise;productivity;office365;AI integration"
"Tesla's FSD Beta Shows 95% Improvement in Urban Driving","Tesla FSD Beta Urban Driving Success","tesla-fsd-beta-urban-improvement","Tesla's Full Self-Driving (FSD) Beta has demonstrated remarkable improvements in urban driving scenarios, with the latest version showing 95% fewer interventions compared to previous iterations. The enhanced neural networks now handle complex intersections, construction zones, and emergency vehicles with human-like decision-making. Tesla plans to expand the beta program to more users while working toward regulatory approval for fully autonomous driving capabilities.","Transportation","Technology;Automotive","https://example.com/images/tesla-fsd.jpg","2024-01-17","16:20","Published","Approved","Public",false,true,"tesla;full self driving;autonomous vehicles;neural networks;transportation"
"Quantum Computing Breakthrough: IBM Achieves 1000-Qubit Milestone","IBM 1000-Qubit Quantum Computer","ibm-1000-qubit-quantum-milestone","IBM has successfully demonstrated a 1000-qubit quantum computer, marking a significant milestone in quantum computing development. The new system, called IBM Quantum Condor, uses advanced error correction techniques and maintains quantum coherence for extended periods. This breakthrough brings practical quantum computing applications closer to reality, with potential impacts on cryptography, drug discovery, financial modeling, and artificial intelligence. IBM plans to make the system available to researchers and enterprise customers through their quantum cloud platform.","Technology","Science;Computing","https://example.com/images/ibm-quantum.jpg","2024-01-16","08:30","Published","Approved","FeaturedOnHomepage",true,true,"ibm;quantum computing;1000 qubit;quantum condor;cryptography;research"
