term,definition,category_name,secondary_category_names,status,source,moderation_status,allow_comments,tags,related_term_names
"Artificial Intelligence","The simulation of human intelligence in machines that are programmed to think and learn like humans. AI systems can perform tasks that typically require human intelligence such as visual perception, speech recognition, decision-making, and language translation.","Technology","Machine Learning;Computer Science","Published","MANUAL","Approved",true,"artificial intelligence;machine learning;AI;technology","Machine Learning;Deep Learning;Neural Networks"
"Machine Learning","A subset of artificial intelligence that enables computers to learn and improve from experience without being explicitly programmed. ML algorithms build mathematical models based on sample data to make predictions or decisions.","Technology","Data Science;Statistics","Published","MANUAL","Approved",true,"machine learning;artificial intelligence;data science;algorithms","Artificial Intelligence;Deep Learning;Data Mining"
"Deep Learning","A subset of machine learning that uses neural networks with multiple layers to model and understand complex patterns in data. It's particularly effective for tasks like image recognition, natural language processing, and speech recognition.","Technology","Neural Networks;Computer Vision","Published","MANUAL","Approved",true,"deep learning;neural networks;machine learning;computer vision","Machine Learning;Neural Networks;Computer Vision"
"Natural Language Processing","A branch of artificial intelligence that helps computers understand, interpret, and manipulate human language. NLP combines computational linguistics with statistical, machine learning, and deep learning models.","Technology","Linguistics;Computer Science","Published","MANUAL","Approved",false,"natural language processing;NLP;computational linguistics;AI","Machine Learning;Computational Linguistics"
"Computer Vision","A field of artificial intelligence that trains computers to interpret and understand visual information from the world. It enables machines to identify and process images, videos, and other visual inputs.","Technology","Image Processing;Robotics","Published","MANUAL","Approved",true,"computer vision;image processing;AI;robotics","Deep Learning;Image Processing;Robotics"
